{
  "incident_id": "inc_09_dropped_index",
  "agent": "metrics_agent",
  "summary": "At 2026-08-28T14:08:00Z several metrics show extreme spikes: p95_search_latency_ms 3500\u202fms, db_disk_read_mb_sec 310\u202fMB/s, db_cpu_pct 99.5% exceeding the 90% threshold, and db_seq_scans_per_sec 140. A period\u2011change record shows db_cpu_pct mean rising by ~58 points versus baseline. Correlation analysis over the 14:00\u201114:08 window reveals very strong positive relationships (r\u22480.99) between db_seq_scans_per_sec and db_disk_read_mb_sec, and between latency and those DB metrics, indicating they move together.",
  "evidence": [
    {
      "evidence_id": "EV-MET-001",
      "source": "metrics",
      "reference": "metrics/metrics.csv:row 7",
      "timestamp": "2026-08-28T14:08:00Z",
      "metric": "p95_search_latency_ms",
      "value": 3500.0,
      "type": "spike",
      "interpretation": "Latency spike to 3500\u202fms, far above baseline (~4.35\u202fms)."
    },
    {
      "evidence_id": "EV-MET-002",
      "source": "metrics",
      "reference": "metrics/metrics.csv:row 7",
      "timestamp": "2026-08-28T14:08:00Z",
      "metric": "db_disk_read_mb_sec",
      "value": 310.0,
      "type": "spike",
      "interpretation": "Disk read rate spike to 310\u202fMB/s, far above baseline (~1.35\u202fMB/s)."
    },
    {
      "evidence_id": "EV-MET-003",
      "source": "metrics",
      "reference": "metrics/metrics.csv:row 7",
      "timestamp": "2026-08-28T14:08:00Z",
      "metric": "db_cpu_pct",
      "value": 99.5,
      "type": "spike",
      "interpretation": "CPU usage spike to 99.5%, near full utilization."
    },
    {
      "evidence_id": "EV-MET-004",
      "source": "metrics",
      "reference": "metrics/metrics.csv:row 7",
      "timestamp": "2026-08-28T14:08:00Z",
      "metric": "db_cpu_pct",
      "value": 99.5,
      "type": "threshold",
      "interpretation": "CPU usage exceeds the defined 90% threshold."
    },
    {
      "evidence_id": "EV-MET-005",
      "source": "metrics",
      "reference": "metrics/metrics.csv:row 7",
      "timestamp": "2026-08-28T14:08:00Z",
      "metric": "db_cpu_pct",
      "value": 99.5,
      "type": "period_change",
      "interpretation": "Mean CPU pct increased by 57.6 points compared to baseline period."
    },
    {
      "evidence_id": "EV-MET-006",
      "source": "metrics",
      "reference": "metrics/metrics.csv:row 7",
      "timestamp": "2026-08-28T14:08:00Z",
      "metric": "db_seq_scans_per_sec",
      "value": 140.0,
      "type": "spike",
      "interpretation": "Sequential scans per second rose to 140, baseline was 0."
    },
    {
      "evidence_id": "EV-MET-007",
      "source": "metrics",
      "reference": "metrics/metrics.csv",
      "timestamp": "2026-08-28T14:00:00Z/2026-08-28T14:08:00Z",
      "metric": "db_seq_scans_per_sec~db_disk_read_mb_sec",
      "value": 0.9983126747233649,
      "type": "correlation",
      "interpretation": "Almost perfect positive correlation (r\u22480.998) between seq scans and disk read rate over the 8\u2011minute window."
    },
    {
      "evidence_id": "EV-MET-008",
      "source": "metrics",
      "reference": "metrics/metrics.csv",
      "timestamp": "2026-08-28T14:00:00Z/2026-08-28T14:08:00Z",
      "metric": "p95_search_latency_ms~db_seq_scans_per_sec",
      "value": 0.9800489958491045,
      "type": "correlation",
      "interpretation": "Strong positive correlation (r\u22480.98) between latency and sequential scans."
    },
    {
      "evidence_id": "EV-MET-009",
      "source": "metrics",
      "reference": "metrics/metrics.csv",
      "timestamp": "2026-08-28T14:00:00Z/2026-08-28T14:08:00Z",
      "metric": "db_disk_read_mb_sec~db_cpu_pct",
      "value": 0.9793060475690416,
      "type": "correlation",
      "interpretation": "Strong positive correlation (r\u22480.98) between disk read rate and CPU usage."
    }
  ]
}